{
  "schema_version": "site2voice.voice.v1",
  "generator": "site2voice/0.5.4",
  "source": "https://stripe.com/",
  "title": "",
  "meta_description": "",
  "metrics": {
    "words": 1748,
    "sentences": 49,
    "avg_sentence_words": 12.6,
    "avg_heading_words": 7.2,
    "avg_paragraph_words": 7.8,
    "avg_cta_words": 2.7,
    "avg_link_words": 2.4,
    "headings": 12,
    "ctas": 12,
    "links": 16,
    "type_token_ratio": 0.301
  },
  "tone": [
    "balanced",
    "action-oriented"
  ],
  "style": {
    "cta_verbs": [
      "sign",
      "start",
      "contact",
      "get",
      "create",
      "watch",
      "read",
      "explore"
    ],
    "punctuation": {
      "periods": 111,
      "questions": 0,
      "exclamations": 0,
      "colons": 1
    }
  },
  "output_contract": {
    "sentence_words": {
      "target": 12.6,
      "min": 9.4,
      "max": 15.8
    },
    "heading_words": {
      "target": 7.2,
      "min": 5.4,
      "max": 9.0
    },
    "paragraph_words": {
      "target": 7.8,
      "min": 5.8,
      "max": 9.8
    },
    "cta_words": {
      "target": 2.7,
      "min": 2.0,
      "max": 3.4
    },
    "recommended_terms": [],
    "source_terms": [],
    "cta_verbs": [
      "sign",
      "start",
      "contact",
      "get",
      "create",
      "watch",
      "read",
      "explore"
    ],
    "minimum_recommended_terms": 0,
    "content_rule": "Use only the new project's nouns. Do not transfer source-specific terms from the reference site.",
    "benchmark_gates": {
      "overall": 75,
      "copy_safety": 85,
      "claim_safety": 75
    }
  },
  "headings": [],
  "ctas": [],
  "links": [],
  "buttons": [],
  "lexicon": [],
  "paragraph_samples": []
}
