{
  "schema_version": "site2voice.voice.v1",
  "generator": "site2voice/0.5.4",
  "source": "https://www.whatsapp.com/",
  "title": "",
  "meta_description": "",
  "metrics": {
    "words": 580,
    "sentences": 20,
    "avg_sentence_words": 10.8,
    "avg_heading_words": 6.8,
    "avg_paragraph_words": 8.9,
    "avg_cta_words": 1.7,
    "avg_link_words": 1.4,
    "headings": 8,
    "ctas": 3,
    "links": 16,
    "type_token_ratio": 0.31
  },
  "tone": [
    "balanced",
    "trust-forward"
  ],
  "style": {
    "cta_verbs": [
      "download",
      "learn",
      "contact"
    ],
    "punctuation": {
      "periods": 40,
      "questions": 0,
      "exclamations": 0,
      "colons": 0
    }
  },
  "output_contract": {
    "sentence_words": {
      "target": 10.8,
      "min": 8.1,
      "max": 13.5
    },
    "heading_words": {
      "target": 6.8,
      "min": 5.1,
      "max": 8.5
    },
    "paragraph_words": {
      "target": 8.9,
      "min": 6.7,
      "max": 11.1
    },
    "cta_words": {
      "target": 1.7,
      "min": 1.3,
      "max": 2.1
    },
    "recommended_terms": [],
    "source_terms": [],
    "cta_verbs": [
      "download",
      "learn",
      "contact"
    ],
    "minimum_recommended_terms": 0,
    "content_rule": "Use only the new project's nouns. Do not transfer source-specific terms from the reference site.",
    "benchmark_gates": {
      "overall": 75,
      "copy_safety": 85,
      "claim_safety": 75
    }
  },
  "headings": [],
  "ctas": [],
  "links": [],
  "buttons": [],
  "lexicon": [],
  "paragraph_samples": []
}
