{
  "schema_version": "site2voice.voice.v1",
  "generator": "site2voice/0.5.5",
  "source": "https://monocle.com/",
  "title": "",
  "meta_description": "",
  "metrics": {
    "words": 2690,
    "sentences": 81,
    "avg_sentence_words": 6.7,
    "avg_heading_words": 8.3,
    "avg_paragraph_words": 7,
    "avg_cta_words": 2.9,
    "avg_link_words": 2.1,
    "headings": 12,
    "ctas": 7,
    "links": 16,
    "type_token_ratio": 0.291
  },
  "tone": [
    "short and direct",
    "action-oriented"
  ],
  "style": {
    "cta_verbs": [
      "see",
      "contact",
      "get",
      "sign",
      "buy"
    ],
    "punctuation": {
      "periods": 24,
      "questions": 13,
      "exclamations": 2,
      "colons": 54
    }
  },
  "output_contract": {
    "sentence_words": {
      "target": 6.7,
      "min": 5.0,
      "max": 8.4
    },
    "heading_words": {
      "target": 8.3,
      "min": 6.2,
      "max": 10.4
    },
    "paragraph_words": {
      "target": 7.0,
      "min": 5.2,
      "max": 8.8
    },
    "cta_words": {
      "target": 2.9,
      "min": 2.2,
      "max": 3.6
    },
    "recommended_terms": [],
    "source_terms": [],
    "cta_verbs": [
      "see",
      "contact",
      "get",
      "sign",
      "buy"
    ],
    "minimum_recommended_terms": 0,
    "content_rule": "Use only the new project's nouns, facts, audience, offer, and domain. Do not transfer source-specific products, categories, slogans, people, campaigns, or topics.",
    "domain_firewall": {
      "reference_supplies": [
        "sentence rhythm",
        "heading shape",
        "CTA shape",
        "section order",
        "rhetorical moves"
      ],
      "design_md_supplies": [
        "colors",
        "typography",
        "spacing",
        "layout grid",
        "components",
        "motion",
        "visual assets"
      ],
      "project_must_supply": [
        "product category",
        "audience",
        "domain nouns",
        "offer",
        "proof",
        "claims",
        "examples",
        "visual subject matter"
      ],
      "rule": "If a noun, claim, or scenario is not in the new project brief, remove it even if it appears in the reference source."
    },
    "benchmark_gates": {
      "overall": 75,
      "copy_safety": 85,
      "claim_safety": 75
    }
  },
  "headings": [],
  "ctas": [],
  "links": [],
  "buttons": [],
  "lexicon": [],
  "paragraph_samples": []
}
