{
  "schema_version": "site2voice.voice.v1",
  "generator": "site2voice/0.5.3",
  "source": "https://github.com/",
  "title": "",
  "meta_description": "",
  "metrics": {
    "words": 1628,
    "sentences": 33,
    "avg_sentence_words": 10.0,
    "avg_heading_words": 5.3,
    "avg_paragraph_words": 12.4,
    "avg_cta_words": 2.8,
    "avg_link_words": 3.1,
    "headings": 12,
    "ctas": 12,
    "links": 16,
    "type_token_ratio": 0.26
  },
  "tone": [
    "short and direct",
    "action-oriented",
    "technical",
    "trust-forward"
  ],
  "style": {
    "cta_verbs": [
      "sign",
      "open",
      "create",
      "try",
      "explore",
      "read"
    ],
    "punctuation": {
      "periods": 41,
      "questions": 2,
      "exclamations": 0,
      "colons": 0
    }
  },
  "output_contract": {
    "sentence_words": {
      "target": 10.0,
      "min": 7.5,
      "max": 12.5
    },
    "heading_words": {
      "target": 5.3,
      "min": 4.0,
      "max": 6.6
    },
    "paragraph_words": {
      "target": 12.4,
      "min": 9.3,
      "max": 15.5
    },
    "cta_words": {
      "target": 2.8,
      "min": 2.1,
      "max": 3.5
    },
    "recommended_terms": [],
    "source_terms": [],
    "cta_verbs": [
      "sign",
      "open",
      "create",
      "try",
      "explore",
      "read"
    ],
    "minimum_recommended_terms": 0,
    "content_rule": "Use only the new project's nouns. Do not transfer source-specific terms from the reference site.",
    "benchmark_gates": {
      "overall": 75,
      "copy_safety": 85,
      "claim_safety": 75
    }
  },
  "headings": [],
  "ctas": [],
  "links": [],
  "buttons": [],
  "lexicon": [],
  "paragraph_samples": []
}
