{
  "schema_version": "site2voice.voice.v1",
  "generator": "site2voice/0.5.0",
  "source": "https://www.shopify.com/",
  "title": "",
  "meta_description": "",
  "metrics": {
    "words": 1771,
    "sentences": 87,
    "avg_sentence_words": 20.4,
    "avg_heading_words": 5.4,
    "avg_paragraph_words": 4.5,
    "avg_cta_words": 3,
    "avg_link_words": 1.9,
    "headings": 12,
    "ctas": 5,
    "links": 16,
    "type_token_ratio": 0.25
  },
  "tone": [
    "explanatory",
    "action-oriented",
    "trust-forward"
  ],
  "style": {
    "cta_verbs": [
      "start",
      "get",
      "build"
    ],
    "punctuation": {
      "periods": 83,
      "questions": 3,
      "exclamations": 0,
      "colons": 1
    }
  },
  "output_contract": {
    "sentence_words": {
      "target": 20.4,
      "min": 15.3,
      "max": 25.5
    },
    "heading_words": {
      "target": 5.4,
      "min": 4.1,
      "max": 6.8
    },
    "paragraph_words": {
      "target": 4.5,
      "min": 4.0,
      "max": 5.6
    },
    "cta_words": {
      "target": 3.0,
      "min": 2.2,
      "max": 3.8
    },
    "recommended_terms": [],
    "source_terms": [],
    "cta_verbs": [
      "start",
      "get",
      "build"
    ],
    "minimum_recommended_terms": 0,
    "content_rule": "Use only the new project's nouns. Do not transfer source-specific terms from the reference site.",
    "benchmark_gates": {
      "overall": 75,
      "copy_safety": 85,
      "claim_safety": 75
    }
  },
  "headings": [],
  "ctas": [],
  "links": [],
  "buttons": [],
  "lexicon": [],
  "paragraph_samples": []
}
