{
  "schema_version": "site2voice.voice.v1",
  "generator": "site2voice/0.5.4",
  "source": "https://linear.app/",
  "title": "",
  "meta_description": "",
  "metrics": {
    "words": 797,
    "sentences": 27,
    "avg_sentence_words": 10.6,
    "avg_heading_words": 7.2,
    "avg_paragraph_words": 16.1,
    "avg_cta_words": 1.6,
    "avg_link_words": 1.4,
    "headings": 12,
    "ctas": 9,
    "links": 16,
    "type_token_ratio": 0.399
  },
  "tone": [
    "balanced",
    "action-oriented",
    "technical"
  ],
  "style": {
    "cta_verbs": [
      "contact",
      "open",
      "sign",
      "build",
      "get",
      "download"
    ],
    "punctuation": {
      "periods": 61,
      "questions": 0,
      "exclamations": 0,
      "colons": 0
    }
  },
  "output_contract": {
    "sentence_words": {
      "target": 10.6,
      "min": 7.9,
      "max": 13.2
    },
    "heading_words": {
      "target": 7.2,
      "min": 5.4,
      "max": 9.0
    },
    "paragraph_words": {
      "target": 16.1,
      "min": 12.1,
      "max": 20.1
    },
    "cta_words": {
      "target": 1.6,
      "min": 1.2,
      "max": 2.0
    },
    "recommended_terms": [],
    "source_terms": [],
    "cta_verbs": [
      "contact",
      "open",
      "sign",
      "build",
      "get",
      "download"
    ],
    "minimum_recommended_terms": 0,
    "content_rule": "Use only the new project's nouns. Do not transfer source-specific terms from the reference site.",
    "benchmark_gates": {
      "overall": 75,
      "copy_safety": 85,
      "claim_safety": 75
    }
  },
  "headings": [],
  "ctas": [],
  "links": [],
  "buttons": [],
  "lexicon": [],
  "paragraph_samples": []
}
