{
  "schema_version": "site2voice.voice.v1",
  "generator": "site2voice/0.5.0",
  "source": "https://www.figma.com/",
  "title": "",
  "meta_description": "",
  "metrics": {
    "words": 1544,
    "sentences": 27,
    "avg_sentence_words": 57.2,
    "avg_heading_words": 4.8,
    "avg_paragraph_words": 3.2,
    "avg_cta_words": 3.2,
    "avg_link_words": 2.7,
    "headings": 12,
    "ctas": 12,
    "links": 16,
    "type_token_ratio": 0.227
  },
  "tone": [
    "explanatory",
    "action-oriented",
    "technical"
  ],
  "style": {
    "cta_verbs": [
      "explore",
      "see",
      "learn",
      "contact",
      "get",
      "build"
    ],
    "punctuation": {
      "periods": 26,
      "questions": 0,
      "exclamations": 0,
      "colons": 4
    }
  },
  "output_contract": {
    "sentence_words": {
      "target": 57.2,
      "min": 42.9,
      "max": 71.5
    },
    "heading_words": {
      "target": 4.8,
      "min": 3.6,
      "max": 6.0
    },
    "paragraph_words": {
      "target": 3.2,
      "min": 4.0,
      "max": 4.0
    },
    "cta_words": {
      "target": 3.2,
      "min": 2.4,
      "max": 4.0
    },
    "recommended_terms": [],
    "source_terms": [],
    "cta_verbs": [
      "explore",
      "see",
      "learn",
      "contact",
      "get",
      "build"
    ],
    "minimum_recommended_terms": 0,
    "content_rule": "Use only the new project's nouns. Do not transfer source-specific terms from the reference site.",
    "benchmark_gates": {
      "overall": 75,
      "copy_safety": 85,
      "claim_safety": 75
    }
  },
  "headings": [],
  "ctas": [],
  "links": [],
  "buttons": [],
  "lexicon": [],
  "paragraph_samples": []
}
